{
  "schema_version": 1,
  "event_type": "deployment.observed",
  "service": {
    "id": "phase4-proof"
  },
  "environment": {
    "id": "resilio-reference-e882d4"
  },
  "change": {
    "repository": "8ft0-ai/resilio",
    "source_sha": "dddc6a605fc6a3eb0b136e24aefe9d98fc807dd7"
  },
  "deployment": {
    "id": "phase4-proof-00002-jq5",
    "release_id": "a24dd47861df1e07f89116493071c70a3119d100611a59e0bb1a67d3fcba11f3",
    "artifact_digest": "sha256:6cd62e8eddfea3b658c20f6a7098f115ac16a9ffcabbb3cfe260e5f9fe0ee8cb",
    "runtime": {
      "provider": "gcp",
      "kind": "cloud_run_revision",
      "resource_id": "projects/resilio-reference-e882d4/locations/us-central1/services/phase4-proof/revisions/phase4-proof-00002-jq5"
    }
  },
  "evidence": [
    {
      "kind": "phase4_release",
      "ref": "deployments/phase4/revisions/a24dd47861df1e07f89116493071c70a3119d100611a59e0bb1a67d3fcba11f3.json"
    },
    {
      "kind": "provider_operation",
      "ref": "baf9da9b-339f-4c30-a41b-845a7311b002"
    },
    {
      "kind": "sbom",
      "ref": "gs://resilio-control-e882d4-phase4-evidence/transitions/3388133e-deca-4a71-9e77-b8917fa105b6.sbom.spdx.json",
      "sha256": "8e6549007c155c1e0a6909d16b0439e3e32968967b44b85c714f9f24f31b855a"
    },
    {
      "kind": "transition",
      "ref": "gs://resilio-control-e882d4-phase4-evidence/transitions/3388133e-deca-4a71-9e77-b8917fa105b6.json",
      "sha256": "52914d83bab8c074f0ba5404f4cf50a75773c34612107e4c9f1388811b4d556c"
    }
  ]
}
